{
  "version": "domain-pack-registry/v0",
  "generated_at": "2026-05-18",
  "source": "docs/operations/adaptive-company-onboarding-domain-packs.md",
  "activation_policy": {
    "model": "opt-in",
    "description": "Operator explicitly selects which domain packs to activate during onboarding. No pack runs until the operator has confirmed the company reality summary and selected the domain. Company.OS activates one pack at a time, starting with the operator's highest-priority domain. Deeper questions are only asked for the chosen domain.",
    "first_pack_default": "marketing-outreach",
    "gate_before_activation": "operator-confirmation-complete",
    "draft_first": true
  },
  "packs": [
    {
      "id": "marketing-outreach",
      "name": "Marketing / Outreach",
      "owner_role": "role:cmo",
      "first_useful_scope": "ICP hypothesis, channel selection, draft messaging, competitor-informed positioning",
      "intake_questions": [
        "What company, product or offer should outreach support?",
        "What is the website and which pages best describe the offer?",
        "Who is the target buyer, user and economic decision maker?",
        "Which channels are currently allowed: email, LinkedIn, X, phone, events, partners, direct mail or print?",
        "What has been tried already?",
        "What must never be claimed?",
        "What tone should be preserved?",
        "Who approves messages before they are sent?"
      ],
      "ai_discovery": [
        "Read public website pages",
        "Summarize offer and proof points",
        "Identify competitors and alternatives",
        "Infer ICP hypotheses",
        "Propose positioning angles"
      ],
      "confirmation_steps": [
        "Present discovery summary grouped by: offer, ICP, channels, competitors",
        "Operator must accept, correct or reject each item before any draft is produced",
        "No draft output is generated until operator explicitly confirms or marks items stale",
        "Loop repeats until all dimensions confirmed or marked stale",
        "Approval owner is identified and recorded; required before HG-2 releases"
      ],
      "outputs": [
        "outreach-context.md",
        "competitor-brief.md",
        "icp-hypotheses.md",
        "message-angles.md",
        "draft-sequence.md",
        "Plane child worker contracts for follow-up work"
      ],
      "claim_policy": {
        "mode": "draft-only",
        "regulated_claim_gate": "separate-gate-required",
        "regulated_classes": ["health", "financial", "legal", "comparative", "superlative"],
        "operator_off-limits_required": true,
        "approval_owner_reviews_all_claims": true,
        "minimum_send_gate": "HG-2"
      },
      "default_human_gate": "HG-2",
      "activation_mode": "draft-only",
      "operator_confirmation_required": true,
      "blocked_actions": [
        "email-send",
        "linkedin-send",
        "x-post",
        "crm-mass-write",
        "scraped-personal-data-storage",
        "public-claim-without-review",
        "regulated-claim-without-gate",
        "distribution-without-approval-owner-sign-off"
      ]
    },
    {
      "id": "content-engine",
      "name": "Content Engine",
      "owner_role": "role:cmo",
      "first_useful_scope": "Editorial calendar, blog draft, LinkedIn draft, newsletter outline, content topic backlog",
      "intake_questions": [
        "What topics, themes or categories should content cover?",
        "Which channels are active: blog, LinkedIn, X, newsletter, podcast or other?",
        "What is the publishing cadence goal?",
        "Who is the primary audience for each channel?",
        "What content has performed well or poorly in the past?",
        "What claims or topics must be avoided?",
        "Who reviews and approves content before publishing?",
        "Are there brand guidelines or tone documents to follow?"
      ],
      "ai_discovery": [
        "Read existing public content and website",
        "Summarize current content themes and gaps",
        "Identify competitor content patterns",
        "Propose initial editorial calendar with topic clusters",
        "Ask operator to confirm or correct"
      ],
      "outputs": [
        "editorial-calendar.md",
        "content-topic-backlog.md",
        "draft-blog-post.md",
        "draft-newsletter.md",
        "Plane child worker contracts for follow-up drafts"
      ],
      "default_human_gate": "HG-2",
      "activation_mode": "draft-only",
      "operator_confirmation_required": true,
      "blocked_actions": [
        "publish-without-review",
        "social-post-without-approval",
        "regulated-claim-without-gate",
        "personal-data-storage-without-consent"
      ]
    },
    {
      "id": "content-machine",
      "name": "Content Machine",
      "owner_role": "role:cmo",
      "first_useful_scope": "Source Inventory, FVBM check, content vault, raw founder brief, research dossier, anchor draft, council review and draft-only release packet before social, blog, video or book lanes run.",
      "intake_questions": [
        "What company, offer, buyer and primary audience should content support?",
        "Which first lane matters most: LinkedIn, X, blog, newsletter, book, video or campaign?",
        "Who approves public founder voice and publishing?",
        "Does a Founder Voice and Belief Model already exist: missing, M0, M1, M2 or M3?",
        "Which sources may be inspected: website, docs, repo, transcripts, notes, analytics export, CRM export, call notes or none yet?",
        "Which topics, claims, customer examples, data classes or private surfaces are off-limits?",
        "What current lead, revenue, trust or authority goal should content support?",
        "What would make generated content sound fake or unsafe under the founder's name?"
      ],
      "ai_discovery": [
        "Summarize the company, audience, channels, approval owner and first business goal from provided sources",
        "Check FVBM status before claiming founder voice fidelity",
        "Create a Source Inventory with sensitivity, owner, freshness and allowed action ceiling",
        "Create scored content vault cards from approved sources or manual founder answers",
        "Route founder-only gaps back to interview instead of hallucinating proof",
        "Run the Content Machine start command and department-pack evaluator before downstream release lanes are considered"
      ],
      "confirmation_steps": [
        "Present the source boundary and off-limits list before reading optional systems",
        "Operator confirms target root, approval owner and first channel",
        "Operator confirms FVBM status or accepts M0 seed interview",
        "No anchor draft claims founder voice until raw founder brief or FVBM evidence exists",
        "No publish, schedule, send or connector write occurs until HG-2.5 or higher release"
      ],
      "outputs": [
        "content/content-machine/RUNBOOK.md",
        "content/content-machine/content-machine.config.json",
        "content/content-machine/01_source_inventory/SOURCE_INVENTORY.md",
        "content/content-machine/02_vault/CONTENT_VAULT.md",
        "content/content-machine/05_raw_briefs/RAW_BRIEF_TEMPLATE.md",
        "content/content-machine/07_council_reviews/COUNCIL_RUBRIC.md",
        "content/content-machine/09_release_packets/",
        "content/content-machine/11_lessons/content-lessons.md",
        "reports/content-machine/research-report.md",
        "reports/content-machine/anchor-draft-report.md"
      ],
      "default_human_gate": "HG-2.5",
      "activation_mode": "draft-only",
      "operator_confirmation_required": true,
      "blocked_actions": [
        "public-publish-without-release",
        "public-upload-without-release",
        "public-schedule-without-release",
        "public-send-without-release",
        "social-cms-newsletter-or-crm-write-without-release",
        "credential-token-cookie-collection",
        "private-source-read-without-source-inventory-approval",
        "regulated-claim-without-gate",
        "founder-voice-identity-change-without-hg4",
        "secret-read",
        "production-write",
        "durable-memory-write-without-confirmation",
        "done-transition-by-worker-or-cao"
      ]
    },
    {
      "id": "video-first-content-engine",
      "name": "Video-First Content Engine",
      "owner_role": "role:cmo",
      "first_useful_scope": "Create a local raw-video drop folder and dry-run package plan for YouTube, clips, social posts and article output without publishing.",
      "intake_questions": [
        "What company, offer and audience should video content support?",
        "Which local target root should hold the video-engine folder structure?",
        "Which channels are in scope: YouTube, LinkedIn, X, blog, newsletter or internal-only?",
        "Who approves upload, scheduling or public publishing?",
        "Which topics, claims, screens, people or data classes are off-limits?",
        "Which health, legal, financial, customer or private-screen content must route to HG-3 or HG-4?",
        "What publishing cadence goal should the pipeline support after dry-runs are proven?",
        "What does a useful first test package include?"
      ],
      "ai_discovery": [
        "Summarize the company, audience, channels and approval owner from provided sources",
        "Create a dry-run-only folder initialization plan",
        "Classify risk boundaries before media processing",
        "Draft CMO parent and child worker contracts with dispatch: manual",
        "Run the start command and evaluator before any publisher adapter is considered"
      ],
      "confirmation_steps": [
        "Present the capture and privacy boundary",
        "Operator confirms target root and approval owner",
        "Operator confirms off-limits claims and data classes",